{
  "$schema": "../schemas/environment_layer_contract.v1.schema.json",
  "schema_version": "environment_layer_contract.v1",
  "generated_at": "2026-05-27",
  "policy": "The local Codex research environment is governed as a seven-layer cybernetic system. Engineering cybernetics remains the core methodology; the seven layers make execution, tools, context, lifecycle, observability, verification, and governance explicit and checkable.",
  "core_methodology_ref": "skills/catalog/control_kernel.json",
  "layer_order": [
    "execution",
    "tool",
    "context",
    "lifecycle",
    "observability",
    "verification",
    "governance"
  ],
  "layers": [
    {
      "id": "execution",
      "label": "Execution / 执行层",
      "plain_meaning": "真正运行命令、写文件、生成输出、启动浏览器或执行自动化的层。",
      "responsibility": "把已确认的路线变成可回滚、可记录、可复现的本地动作。",
      "source_contracts": [
        "skills/catalog/settings.toml",
        "skills/catalog/protected_runtime_paths.json",
        "skills/scripts/envctl",
        "AGENTS.md"
      ],
      "primary_components": [
        "Python",
        "PowerShell",
        "Git",
        "envctl",
        "Codex runtime skills",
        "local automations"
      ],
      "observability": [
        "command stdout/stderr",
        "git status",
        "automation ledger",
        "runtime skill drift report"
      ],
      "verification": [
        "git diff --check",
        "py_compile",
        "validate_research_stack",
        "protected path checks"
      ]
    },
    {
      "id": "tool",
      "label": "Tool / 工具层",
      "plain_meaning": "MCP、插件、浏览器、Zotero、OpenAlex、CNKI、Google Scholar、Scite、image2 等能力接口。",
      "responsibility": "作为受控传感器和执行器服务路线，不成为新的总入口。",
      "source_contracts": [
        "skills/catalog/route_mcp_activation_policy.json",
        "skills/catalog/scholar_browser_patterns.json",
        "skills/catalog/cnki_zotero_workflow.json"
      ],
      "primary_components": [
        "MCP servers",
        "OpenAI plugins",
        "Chrome/Playwright",
        "Zotero",
        "OpenAlex",
        "Semantic Scholar",
        "CNKI",
        "Google Scholar",
        "Scite",
        "image2"
      ],
      "observability": [
        "MCP activation policy",
        "browser smoke reports",
        "runtime probe paths"
      ],
      "verification": [
        "route-mcp-policy consistency",
        "validate_research_stack command probes",
        "tool-specific smoke tests"
      ]
    },
    {
      "id": "context",
      "label": "Context / 上下文层",
      "plain_meaning": "AGENTS、项目事实、材料边界、证据账本、Zotero、Obsidian 和记忆候选。",
      "responsibility": "保证模型知道当前任务依据什么材料、哪些内容可用、哪些内容不能编。",
      "source_contracts": [
        "AGENTS.md",
        "skills/catalog/memory_admission_policy.json",
        "skills/catalog/local_memory_system.json",
        "skills/catalog/citation_verification_rules.json"
      ],
      "primary_components": [
        "project truth sources",
        "material-passport",
        "evidence ledger",
        "Zotero",
        "Obsidian",
        "Codex native memory pointers"
      ],
      "observability": [
        "memory status report",
        "citation evidence records",
        "Obsidian sync summaries"
      ],
      "verification": [
        "envctl validate memory",
        "citation gate",
        "writing-reference-capture",
        "structured reading checks"
      ]
    },
    {
      "id": "lifecycle",
      "label": "Lifecycle / 生命周期层",
      "plain_meaning": "研究从选题、文献、阅读、标注、写作、绘图、审稿、修改、润色、投稿到复盘的阶段链。",
      "responsibility": "让 AI 主动确认当前阶段，并在进入下一阶段前询问用户。",
      "source_contracts": [
        "skills/catalog/research_pipeline_stages.json",
        "skills/catalog/project_scope_rules.json",
        "skills/catalog/project_folder_contract.json",
        "skills/catalog/peer_review_workflow.json",
        "skills/catalog/manuscript_writing_workflow.json"
      ],
      "primary_components": [
        "research-autopilot routes",
        "quality gates",
        "stage progression prompts",
        "project-retrospective-evolver"
      ],
      "observability": [
        "stage status",
        "quality gate reports",
        "project retrospectives"
      ],
      "verification": [
        "validate_research_pipeline",
        "stage gate overrides",
        "project initializer checks"
      ]
    },
    {
      "id": "observability",
      "label": "Observability / 可观测层",
      "plain_meaning": "日志、日报、审计报告、状态报告、失败原因和运行痕迹。",
      "responsibility": "让环境知道自己做了什么、哪里失败、为什么不能继续。",
      "source_contracts": [
        "WORKSPACE-LOG.md",
        "skills/outputs/reports",
        "skills/catalog/evolution_backlog.json",
        "skills/catalog/local_memory_system.json"
      ],
      "primary_components": [
        "cybernetics daily reports",
        "evolution intake reports",
        "memory status reports",
        "validator envelopes",
        "automation ledgers"
      ],
      "observability": [
        "validator_result.v1",
        "summary reports",
        "git history"
      ],
      "verification": [
        "report schema validation",
        "weekly review scope",
        "stack summary"
      ]
    },
    {
      "id": "verification",
      "label": "Verification / 校验层",
      "plain_meaning": "schema、validator、质量门、引用核验、图表一致性、复现包和提交前检查。",
      "responsibility": "阻断不稳定、不真实、不可复现或越界的输出。",
      "source_contracts": [
        "skills/schemas",
        "skills/catalog/quality_gates.json",
        "skills/scripts/validate_research_pipeline.py",
        "skills/scripts/validate_research_stack.py"
      ],
      "primary_components": [
        "jsonschema validation",
        "envctl validate",
        "legacy validators",
        "quality gates",
        "unit tests"
      ],
      "observability": [
        "validator envelopes",
        "failed command list",
        "quality gate reports"
      ],
      "verification": [
        "validate_subagent_registry",
        "validate_agents_contract",
        "validate_research_pipeline",
        "validate_research_stack"
      ]
    },
    {
      "id": "governance",
      "label": "Governance / 治理层",
      "plain_meaning": "工程控制论控制核、总路由、权限边界、外部吸收策略、保护目录和回滚规则。",
      "responsibility": "决定什么能进入系统、谁是入口、哪里可以写、如何演化、如何回滚。",
      "source_contracts": [
        "skills/catalog/control_kernel.json",
        "skills/catalog/conflict_matrix.json",
        "skills/catalog/external_adoption_reviews.json",
        "skills/catalog/environment_layer_contract.json"
      ],
      "primary_components": [
        "research-autopilot",
        "vela-runtime-manager",
        "project-retrospective-evolver",
        "skill-vetter",
        "envctl"
      ],
      "observability": [
        "conflict matrix",
        "external adoption review",
        "cross repo drift report"
      ],
      "verification": [
        "envctl validate cybernetics",
        "envctl validate environment-layers",
        "envctl validate drift"
      ]
    }
  ],
  "route_layer_map": [
    {
      "route_id": "stack-governance",
      "main_layer": "governance",
      "required_layers": [
        "execution",
        "tool",
        "context",
        "lifecycle",
        "observability",
        "verification",
        "governance"
      ],
      "lifecycle_stages": [
        "stack_governance"
      ],
      "verification_gates": []
    },
    {
      "route_id": "single-paper-review",
      "main_layer": "verification",
      "required_layers": [
        "execution",
        "tool",
        "context",
        "lifecycle",
        "observability",
        "verification",
        "governance"
      ],
      "lifecycle_stages": [
        "citation_verification",
        "paper_assessment",
        "writing_synthesis"
      ],
      "verification_gates": [
        "doi_and_metadata_verified",
        "writing_quality_checked",
        "peer_review_protocol_checked"
      ]
    },
    {
      "route_id": "environment-ops",
      "main_layer": "execution",
      "required_layers": [
        "execution",
        "tool",
        "context",
        "lifecycle",
        "observability",
        "verification",
        "governance"
      ],
      "lifecycle_stages": [
        "environment_maintenance"
      ],
      "verification_gates": []
    },
    {
      "route_id": "project-folder-hygiene",
      "main_layer": "lifecycle",
      "required_layers": [
        "execution",
        "tool",
        "context",
        "lifecycle",
        "observability",
        "verification",
        "governance"
      ],
      "lifecycle_stages": [
        "environment_maintenance",
        "package_freeze",
        "project_retrospective"
      ],
      "verification_gates": []
    },
    {
      "route_id": "project-retrospective",
      "main_layer": "lifecycle",
      "required_layers": [
        "execution",
        "tool",
        "context",
        "lifecycle",
        "observability",
        "verification",
        "governance"
      ],
      "lifecycle_stages": [
        "project_retrospective"
      ],
      "verification_gates": [
        "retrospective_recorded"
      ]
    },
    {
      "route_id": "long-running-experiment-ops",
      "main_layer": "execution",
      "required_layers": [
        "execution",
        "tool",
        "context",
        "lifecycle",
        "observability",
        "verification",
        "governance"
      ],
      "lifecycle_stages": [
        "runtime_supervision"
      ],
      "verification_gates": []
    },
    {
      "route_id": "evidence-based-literature-workflow",
      "main_layer": "context",
      "required_layers": [
        "execution",
        "tool",
        "context",
        "lifecycle",
        "observability",
        "verification",
        "governance"
      ],
      "lifecycle_stages": [
        "research_design",
        "literature_discovery",
        "citation_verification",
        "data_material_acquisition",
        "writing_synthesis",
        "review_revision"
      ],